{
  "$id": "cjc.simulation-output/1",
  "$schema": "https://json-schema.org/draft/2020-12/schema",
  "$defs": {
    "Identity": {"type":"object","additionalProperties":false,"required":["id","sha256"],"properties":{"id":{"type":"string","minLength":1},"sha256":{"type":"string","pattern":"^[0-9a-f]{64}$","minLength":64,"maxLength":64}}},
    "Artifact": {"type":"object","additionalProperties":false,"required":["id","sha256","bytes"],"properties":{"id":{"type":"string","minLength":1},"sha256":{"type":"string","pattern":"^[0-9a-f]{64}$","minLength":64,"maxLength":64},"bytes":{"type":"integer","exclusiveMinimum":0}}},
    "Segment": {"type":"object","additionalProperties":false,"required":["id","attempt_id","restart_parent"],"properties":{"id":{"type":"string","minLength":1},"attempt_id":{"type":"string","minLength":1},"restart_parent":{"anyOf":[{"$ref":"#/$defs/Identity"},{"type":"null"}]}}},
    "Selection": {"type":"object","additionalProperties":false,"required":["time","artifact_id","record_index","segment_id"],"properties":{"time":{"type":"string","pattern":"^\\d{4}-\\d{2}-\\d{2}T\\d{2}:\\d{2}:\\d{2}Z$"},"artifact_id":{"type":"string","minLength":1},"record_index":{"type":"integer","minimum":0},"segment_id":{"type":"string","minLength":1}}},
    "Variable": {"type":"object","additionalProperties":false,"required":["name","units"],"properties":{"name":{"type":"string","minLength":1},"units":{"type":"string","minLength":1}}},
    "Simulation": {"type":"object","additionalProperties":false,"required":["id","mode","configuration","controller","wrf_build","wps_build","scientific_policy","output_policy","initial_state"],"properties":{"id":{"type":"string","minLength":1},"mode":{"type":"string","enum":["continuous","daily_reinit"]},"configuration":{"$ref":"#/$defs/Identity"},"controller":{"$ref":"#/$defs/Identity"},"wrf_build":{"$ref":"#/$defs/Identity"},"wps_build":{"$ref":"#/$defs/Identity"},"scientific_policy":{"$ref":"#/$defs/Identity"},"output_policy":{"$ref":"#/$defs/Identity"},"initial_state":{"$ref":"#/$defs/Identity"}}}
  },
  "type":"object",
  "additionalProperties":false,
  "required":["contract","id","simulation","domain","grid","variables","start","end","history_seconds","completeness","missing_times","partial_reason","artifacts","segments","selections","execution_evidence"],
  "properties": {
    "contract":{"type":"string","const":"cjc.simulation-output/1"},
    "id":{"type":"string","minLength":1},
    "simulation":{"$ref":"#/$defs/Simulation"},
    "domain":{"type":"string","enum":["d01","d02"]},
    "grid":{"$ref":"#/$defs/Identity"},
    "variables":{"type":"array","minItems":1,"items":{"$ref":"#/$defs/Variable"}},
    "start":{"type":"string","pattern":"^\\d{4}-\\d{2}-\\d{2}T\\d{2}:\\d{2}:\\d{2}Z$"},
    "end":{"type":"string","pattern":"^\\d{4}-\\d{2}-\\d{2}T\\d{2}:\\d{2}:\\d{2}Z$"},
    "history_seconds":{"type":"integer","exclusiveMinimum":0,"maximum":86400},
    "completeness":{"type":"string","enum":["complete","partial"]},
    "missing_times":{"type":"array","items":{"type":"string","pattern":"^\\d{4}-\\d{2}-\\d{2}T\\d{2}:\\d{2}:\\d{2}Z$"}},
    "partial_reason":{"anyOf":[{"type":"string","minLength":1},{"type":"null"}]},
    "artifacts":{"type":"array","items":{"$ref":"#/$defs/Artifact"}},
    "segments":{"type":"array","items":{"$ref":"#/$defs/Segment"}},
    "selections":{"type":"array","items":{"$ref":"#/$defs/Selection"}},
    "execution_evidence":{"$ref":"#/$defs/Identity"}
  }
}
